{
  "$schema": "./node_modules/@snorreks/firestack/firestack.schema.json",
  "flavors": {
    "development": "my-project-dev",
    "production": "my-project-prod"
  },
  "region": "us-central1",
  "functionsDirectory": "src/controllers",
  "rulesDirectory": "src/rules",
  "scriptsDirectory": "scripts",
  "initScript": "on_emulate.ts",
  "nodeVersion": "22",
  "engine": "bun",
  "packageManager": "global"
}
